<?xml version="1.0" encoding="utf-8"?>
<opus xmlns="https://lenz-archiv.de"
	xmlns:xsi="http://www.w3.org/2001/XMLSchema-instance"
	xsi:schemaLocation="https://lenz-archiv.de ../xsd/traditions.xsd">
	<traditions>
		<letterTradition letter="1">
			<app ref="4">
				Riga, Latvijas Valsts Vēstures Arhīvs, Fonda 4038, Aprakst 2, Lietas 1639, (Nr. 103), S.
				377–378.
			</app>
		</letterTradition>
		<letterTradition letter="2">
			<app ref="4">
				Riga, Latvijas Akadēmiskā Bibliotekā, [1] Nachlaß J. M. R. Lenz, Ms. 1113, F. 25, V. 31, Nr.
				2.
			</app>
		</letterTradition>
		<letterTradition letter="3">
			<app ref="4">
				Riga, Latvijas Akadēmiskā Bibliotekā, [1] Nachlaß J. M. R. Lenz, Ms. 1113, F. 25, V. 31, Nr.
				3.
			</app>
		</letterTradition>
		<letterTradition letter="4">
			<app ref="4">
				Riga, Latvijas Akadēmiskā Bibliotekā, [1] Nachlaß J. M. R. Lenz, Ms. 1113, F. 25, V. 31, Nr.
				4.
			</app>
		</letterTradition>

		<letterTradition letter="5">
			<app ref="4">
				Riga, Latvijas Akadēmiskā Bibliotekā, [1] Nachlaß J. M. R. Lenz, Ms. 1113, F. 25, V. 31, Nr.
				5.
			</app>
		</letterTradition>

		<letterTradition letter="6">
			<app ref="4">
				Riga, Latvijas Akadēmiskā Bibliotekā, [1] Nachlaß J. M. R. Lenz, Ms. 1113, F. 25, V. 31, Nr. 32. Es handelt sich um einen Doppelbrief; der Brief des Bruders Johann Christian Lenz lautet: „Königsberg, den 14 Octobr. ds. St. 1769 / Verehrungswürdiger Herr Papa, / Sie bekommen jetzt einen Brief en migniature, weil ich eben nicht viel Materie zum Schreiben habe, und doch bey dem Anfange eines neuen Semesiris academici nicht versäumen will, Ihnen eine kleine Nachricht von meinen Collegiis zu geben; und überdem schon sehnsuchtsvoll auf einen Brief von Ihnen warte, wozu dieser eigentlich ein kleines Beschleunigungs-Mittel seyn soll. – Ich werde in diesem halben Jahre, Logic und Metaphysik bey H. Mag. Kant repetiren, und das Jus elementare bey H. CriminalRath Jester continuiren. Die neuen Collegia, die ich höre sind 1) die Institutiones, bey H. Crim.Rath Jester, welche ein gantzes Jahr gelesen werden und 8 Rthl. kosten, hiezu habe ich aus Hartungs Buchladen Heineccii Institutiones a 2 fl, ausgenommen. 2) die civil und militair Baukunst, als einer der wichtigsten Theile der Mathesis applicatae bey H. M. Reusch; wofür 4 Rthl. bezahlet wird. Außerdem fahre ich noch einige Monate fort Information auf dem Flauto Trav. zu nehmen. Dieß ist der eintzige Maitre, den ich mir halten kann. – Es würde zu weitläuftig, und überflüßig seyn, Ihnen eine neue Specification meiner Ausgaben aufzusetzen, weil Sie dieses aus denen vom vorigen Jahre leicht absehen können, ob ich gleich mit denen 40 Duc. das halbe Jahr, welche ich Ihnen pro fixo angegeben, kümmerlich auszukommen suchen muß. / Ich komme, bester Papa, auf die eigentliche Absicht meines Briefes, nehmlich Sie gehorsamst zu bitten, die Remittirung des Geldes, welches Sie mir aus Ihrer Güte, auf dieses halbe Jahr zugedacht, gütigst, so bald es Ihnen möglich ist, zu beschleunigen. Ich kann leicht denken, daß es Ihnen zu schwer fallen wird, mir das fixum aufs halbe Jahr auf einmahl zu übermachen, dahero ich Ihrer väterlichen Güte genugsamen Dank schuldig seyn werde, wenn Sie mir für dieses Viertel-Jahr 20 Duc. und außerdem 12 Duc. zu einer mittelmäßig ordentlichen Kleidung überschikken wollten. Allein ich würde Schaden in meiner Wirthschaft leiden, wenn Sie es mir in noch kleineren Posten remittiren wollten, weil ich alsdenn die praenumeranda nicht praenumeriren, und kleine vom vorigen halben Jahre übriggebliebenen Schulden nicht bezahlen könnte. Am meisten ist mir aber daran gelegen, daß Sie mich nicht in der Verlegenheit laßen, länger ohne Geld zu leben. Ich verlaße mich in diesem Stücke auf Ihre väterliche Liebe und Güte. – Zu dem, was Jacob Ihnen von dem Begräbniße eines unserer Landsleute geschrieben, der Armuths-halber von uns mußte begraben werden, habe nichts hinzuzusetzen. Ich schließe also mit der Bitte, allen unsern Geschwistern u. Freunden, besonders aber unserer verehrungswürdigen Mama uns gantz gehorsamst zu empfehlen. – Ich küße Ihnen mit der zärtlichsten Ehrerbietung die Hände, als / Dero gantz gehorsamster Sohn / Johann Christian Lenz. / P.S. Eben fällt mir ein, daß Sie diesen Brief um die Zeit bekommen werden, da Sie Ihren Hochzeits-Tag celebriren. Ich wünsche Ihnen in aller Kürtze viel Glück Heil u. Seegen zu diesem mir so wichtigen Tage. Die Barmherzigkeit Gottes, laße Sie diesen Tag noch eine lange Reihe von Jahren in dem beständigsten Glück und Zufriedenheit feyern, und Sie immer mit einer neuen Zärtlichkeit, dieses glückliche Band erneuern. – Unser nächster Brief wird vermuthlich stärker werden, u. mehr Neuigkeiten enthalten, wie dieser, weil ich jetzt gar keine weiß. Leben Sie nochmals alle insgesammt recht sehr wohl. – / In größter Eil“ (Latvijas Akademiska Biblioteka, Fonds 25, Ms. 1113, Akte 36, Nr. 7.; Bosse, Heinrich: Lenz in Königsberg. In: Stephan/Winter 2003, S. 211f.).
			</app>
		</letterTradition>

		<letterTradition letter="7">
			<app ref="4">
				Freye/Stammler Bd. 1, S. 13–17. Entwurf auf einem Foliobogen.
			</app>
		</letterTradition>

		<letterTradition letter="8">
			<app ref="4">
				August Stöber: Der Aktuar Salzmann, Goethe’s Freund und Tischgenosse in Strassburg.
				Frankfurt am Main 1855, S. 64–71. Stöber spricht davon, dass „einige unvollständige Blättchen bei den Briefen [liegen], welche einzelne philosophische und theologische Betrachtungen, besonders über Leibnitz, enthalten.“ Die Manuskripte der Briefe an Salzmann sind beim Brand der Straßburger Bibliothek 1870 verloren gegangen.
			</app>
		</letterTradition>

		<letterTradition letter="9">
			<app ref="4">
				August Stöber: Der Dichter Lenz und Friederike von Sesenheim. Basel 1842, S. 45–48; aus dem
				Nachlass von Salzmann; tlw. auch überliefert in: Geliebte Schatten. Bildnisse und
				Autographen von Klopstock, Wieland, Herder, Lessing, Schiller, Göthe […], hrsg. von
				Friedrich Götz. Mannheim 1858, S. 149; Auszüge von Friederike Brions Hand. Stöber spricht davon, dass „einige unvollständige Blättchen bei den Briefen [liegen], welche einzelne philosophische und theologische Betrachtungen, besonders über Leibnitz, enthalten.“ Die Manuskripte der Briefe an Salzmann sind beim Brand der Straßburger Bibliothek 1870 verloren gegangen.
			</app>
		</letterTradition>

		<letterTradition letter="10">
			<app ref="4">
				August Stöber: Der Dichter Lenz und Friederike von Sesenheim. Basel 1842, S. 48–50; aus dem
				Nachlass von Salzmann; tlw. überliefert auch in: Geliebte Schatten. Bildnisse und
				Autographen von Klopstock, Wieland, Herder, Lessing, Schiller, Göthe […], hrsg. von
				Friedrich Götz. Mannheim 1858, S. 151; Auszüge von Leopold Wagners Hand. Stöber spricht davon, dass „einige unvollständige Blättchen bei den Briefen [liegen], welche einzelne philosophische und theologische Betrachtungen, besonders über Leibnitz, enthalten.“ Die Manuskripte der Briefe an Salzmann sind beim Brand der Straßburger Bibliothek 1870 verloren gegangen.
			</app>
		</letterTradition>

		<letterTradition letter="11">
			<app ref="4">
				Kraków, Biblioteka Jagiellońska, Lenziana 5, Nr. 8, Abschrift („Cop. v. Dumpf“)
			</app>
		</letterTradition>

		<letterTradition letter="12">
			<app ref="4">
				August Stöber: Der Dichter Lenz und Friederike von Sesenheim. Basel 1842, S. 51f. Stöber spricht davon, dass „einige unvollständige Blättchen bei den Briefen [liegen], welche einzelne philosophische und theologische Betrachtungen, besonders über Leibnitz, enthalten.“ Die Manuskripte der Briefe an Salzmann sind beim Brand der Straßburger Bibliothek 1870 verloren gegangen.
			</app>
		</letterTradition>

		<letterTradition letter="13">
			<app ref="4">
				Kraków, Biblioteka Jagiellońska, Lenziana 5, Nr. 9
			</app>
		</letterTradition>

		<letterTradition letter="14">
			<app ref="4">
				August Stöber: Der Dichter Lenz und Friederike von Sesenheim. Basel 1842, S. 55–57. Stöber spricht davon, dass „einige unvollständige Blättchen bei den Briefen [liegen], welche einzelne philosophische und theologische Betrachtungen, besonders über Leibnitz, enthalten.“ Die Manuskripte der Briefe an Salzmann sind beim Brand der Straßburger Bibliothek 1870 verloren gegangen.
			</app>
		</letterTradition>

		<letterTradition letter="15">
			<app ref="4">
				August Stöber: Der Dichter Lenz und Friederike von Sesenheim. Basel 1842, S. 52–55. Stöber spricht davon, dass „einige unvollständige Blättchen bei den Briefen [liegen], welche einzelne philosophische und theologische Betrachtungen, besonders über Leibnitz, enthalten.“ Die Manuskripte der Briefe an Salzmann sind beim Brand der Straßburger Bibliothek 1870 verloren gegangen.
			</app>
		</letterTradition>

		<letterTradition letter="16">
			<app ref="4">
				August Stöber: Der Dichter Lenz und Friederike von Sesenheim. Basel 1842, S. 57–59. Stöber spricht davon, dass „einige unvollständige Blättchen bei den Briefen [liegen], welche einzelne philosophische und theologische Betrachtungen, besonders über Leibnitz, enthalten.“ Die Manuskripte der Briefe an Salzmann sind beim Brand der Straßburger Bibliothek 1870 verloren gegangen.
			</app>
		</letterTradition>

		<letterTradition letter="17">
			<app ref="4">
				Kraków, Biblioteka Jagiellońska, Lenziana 5, Nr. 10, Abschrift („Copia eines Briefes“). Eingelegter Brief nicht ermitttelt.
			</app>
		</letterTradition>

		<letterTradition letter="18">
			<app ref="4">
				August Stöber: Der Dichter Lenz und Friederike von Sesenheim. Basel 1842, S. 60–62. Stöber spricht davon, dass „einige unvollständige Blättchen bei den Briefen [liegen], welche einzelne philosophische und theologische Betrachtungen, besonders über Leibnitz, enthalten.“ Die Manuskripte der Briefe an Salzmann sind beim Brand der Straßburger Bibliothek 1870 verloren gegangen.
			</app>
		</letterTradition>

		<letterTradition letter="19">
			<app ref="4">